{
  "$schema": "https://json-schema.org/draft/2020-12/schema",
  "$id": "https://gisbb.kz/schemas/factor.schema.json",
  "title": "Фактор риска ГИС ББ",
  "description": "Одна запись каталога факторов риска инфекции. Файлы data/<код_инфекции>.json содержат массив таких объектов.",
  "type": "object",
  "required": ["no", "category", "name", "type", "weight", "tier", "red_trigger", "scale"],
  "additionalProperties": true,
  "properties": {
    "no": {
      "type": "integer",
      "minimum": 1,
      "description": "Номер фактора внутри каталога инфекции. Уникален. Используется как ключ при передаче баллов. Нумерация может содержать пропуски (изъятые при ревизии факторы)."
    },
    "category": {
      "type": "string",
      "minLength": 1,
      "description": "Категория фактора (тематическая группа). Используется для группировки в интерфейсе и для категорийных срезов оценки."
    },
    "name": {
      "type": "string",
      "minLength": 1,
      "description": "Полное наименование фактора, включая единицу измерения, если она есть."
    },
    "type": {
      "enum": ["numeric", "binary"],
      "description": "numeric - количественный фактор с градуированной шкалой 0-4. binary - качественный фактор типа «есть/нет»: допустимы только баллы 0 и 4."
    },
    "weight": {
      "type": "integer",
      "minimum": 1,
      "maximum": 4,
      "description": "Весовой коэффициент вклада фактора в интегральную оценку. 4 - критическая значимость, 3 - высокая, 2 - умеренная, 1 - дополнительная."
    },
    "tier": {
      "enum": ["basic", "extended"],
      "description": "Панель. basic - обязательная экспресс-оценка во всех регионах. extended - углублённая региональная экспертиза."
    },
    "red_trigger": {
      "type": "boolean",
      "description": "Признак красного триггера. Если true и выставленный балл >= 3, регион переводится в режим экстренного реагирования независимо от значения интегрального индекса."
    },
    "direction": {
      "type": "string",
      "enum": ["выше=хуже", "ниже=хуже"],
      "description": "Направление шкалы. «выше=хуже» - прямая шкала (рост показателя повышает балл риска). «ниже=хуже» - обратная (снижение показателя повышает балл риска). Справочное поле: на расчёт не влияет, пороги уже заданы в scale."
    },
    "scale": {
      "type": "object",
      "description": "Пороговые значения для каждого балла. Ключ - балл в виде строки, значение - текстовое описание порога. У numeric заданы все пять баллов 0-4, у binary только 0 и 4.",
      "propertyNames": { "enum": ["0", "1", "2", "3", "4"] },
      "additionalProperties": { "type": "string", "minLength": 1 },
      "minProperties": 2
    },
    "factor_class": {
      "type": "string",
      "enum": ["structural", "dynamic", "readiness", "unclassified"],
      "description": "Класс по динамике изменения. structural - медленно меняющийся (ландшафт, инфраструктура). dynamic - быстро меняющийся (эпизоотия, заболеваемость). readiness - управляемая готовность (запасы, регламенты, охваты)."
    },
    "priority": {
      "type": "string",
      "description": "Внутренняя метка приоритета источника (A0, A, B, C). Справочная, на расчёт не влияет."
    },
    "gid": {
      "type": "string",
      "description": "Сквозной идентификатор фактора для межверсионного сопоставления. Справочный."
    },
    "source_data": {
      "type": "string",
      "description": "Источник первичных данных для заполнения балла: ведомства и информационные системы."
    },
    "rationale": {
      "type": "string",
      "description": "Обоснование включения фактора в каталог."
    },
    "measures": {
      "type": "string",
      "description": "Меры снижения риска, применяемые при высоком балле фактора."
    },
    "normative_doc": {
      "type": "string",
      "description": "Нормативные правовые акты Республики Казахстан, регулирующие фактор."
    },
    "responsible": {
      "type": "string",
      "description": "Ответственные органы и организации."
    }
  }
}
