[
 {
  "no": 1,
  "category": "Эпизоотическая активность",
  "name": "Доля территории региона в природных/автономных очагах чумы, %",
  "type": "numeric",
  "weight": 3,
  "red_trigger": false,
  "direction": "выше=хуже",
  "scale": {
   "0": "<5",
   "1": "5–14",
   "2": "15–29",
   "3": "30–49",
   "4": "≥50"
  },
  "source_data": "КСЭК; ННЦООИ; ветеринарные и медицинские ИС; ГИС ББ",
  "rationale": "Использовать для корректировки НПА и цифровой оценки риска",
  "gid": "V-1",
  "priority": "A0",
  "factor_class": "structural",
  "measures": "Реализация комплексных противочумных мероприятий в очаге согласно нормативным правовым актам.",
  "normative_doc": "Закон РК № 122-VII от 21.05.2022; Приказ МЗ РК № ҚР ДСМ-114; ветеринарные правила.",
  "responsible": "ННЦООИ им. М. Айкимбаева; КСЭК; МИО.",
  "tier": "basic"
 },
 {
  "no": 2,
  "category": "Эпизоотическая активность",
  "name": "Площадь участков высокой эпизоотической активности в пределах очага, %",
  "type": "numeric",
  "weight": 4,
  "red_trigger": false,
  "direction": "выше=хуже",
  "scale": {
   "0": "0",
   "1": ">0–5",
   "2": ">5–15",
   "3": ">15–30",
   "4": ">30"
  },
  "source_data": "КСЭК; ННЦООИ; ветеринарные и медицинские ИС; ГИС ББ",
  "rationale": "Использовать для корректировки НПА и цифровой оценки риска",
  "gid": "V-2",
  "priority": "A0",
  "factor_class": "structural",
  "measures": "Эпизоотологическое и энтомологическое обследование очаговых территорий; ДДД-обработка (дератизация, дезинсекция, дезинфекция); сезонный мониторинг численности резервуаров и переносчиков; экстренная актуализация GIS-паспорта очага.",
  "normative_doc": "Закон РК «О биологической безопасности» № 122-VII от 21.05.2022; Приказ МЗ РК № ҚР ДСМ-114 от 12.11.2021 (санитарные правила по особо опасным инфекциям); санитарные правила по чуме.",
  "responsible": "ННЦООИ им. М. Айкимбаева (противочумная служба); КСЭК; территориальные противочумные станции; МИО.",
  "tier": "basic"
 },
 {
  "no": 3,
  "category": "Эпизоотическая активность",
  "name": "Индекс численности основных резервуаров, % от многолетнего среднего",
  "type": "numeric",
  "weight": 3,
  "red_trigger": false,
  "direction": "выше=хуже",
  "scale": {
   "0": "<50",
   "1": "50–79",
   "2": "80–119",
   "3": "120–179",
   "4": "≥180"
  },
  "source_data": "КСЭК; ННЦООИ; ветеринарные и медицинские ИС; ГИС ББ",
  "rationale": "Использовать для корректировки НПА и цифровой оценки риска",
  "gid": "V-3",
  "priority": "A0",
  "factor_class": "dynamic",
  "measures": "Эпизоотологическое и энтомологическое обследование очаговых территорий; ДДД-обработка (дератизация, дезинсекция, дезинфекция); сезонный мониторинг численности резервуаров и переносчиков; экстренная актуализация GIS-паспорта очага.",
  "normative_doc": "Закон РК «О биологической безопасности» № 122-VII от 21.05.2022; Приказ МЗ РК № ҚР ДСМ-114 от 12.11.2021 (санитарные правила по особо опасным инфекциям); санитарные правила по чуме.",
  "responsible": "ННЦООИ им. М. Айкимбаева (противочумная служба); КСЭК; территориальные противочумные станции; МИО.",
  "tier": "basic"
 },
 {
  "no": 4,
  "category": "Эпизоотическая активность",
  "name": "Индекс блох на основном хозяине (Rhombomys opimus / Meriones spp. / Xenopsylla skrjabini), среднее число блох на особь",
  "type": "numeric",
  "weight": 4,
  "red_trigger": false,
  "direction": "выше=хуже",
  "scale": {
   "0": "0–1",
   "1": ">1–3",
   "2": ">3–5",
   "3": ">5–10",
   "4": ">10"
  },
  "source_data": "КСЭК; ННЦООИ; ветеринарные и медицинские ИС; ГИС ББ",
  "rationale": "Использовать для корректировки НПА и цифровой оценки риска",
  "gid": "V-4",
  "priority": "A0",
  "factor_class": "dynamic",
  "measures": "Эпизоотологическое и энтомологическое обследование очаговых территорий; ДДД-обработка (дератизация, дезинсекция, дезинфекция); сезонный мониторинг численности резервуаров и переносчиков; экстренная актуализация GIS-паспорта очага.",
  "normative_doc": "Закон РК «О биологической безопасности» № 122-VII от 21.05.2022; Приказ МЗ РК № ҚР ДСМ-114 от 12.11.2021 (санитарные правила по особо опасным инфекциям); санитарные правила по чуме.",
  "responsible": "ННЦООИ им. М. Айкимбаева (противочумная служба); КСЭК; территориальные противочумные станции; МИО.",
  "tier": "basic"
 },
 {
  "no": 5,
  "category": "Эпизоотическая активность",
  "name": "Доля положительных проб от диких млекопитающих на Y. pestis, %",
  "type": "numeric",
  "weight": 4,
  "red_trigger": false,
  "direction": "выше=хуже",
  "scale": {
   "0": "0",
   "1": ">0–0,5",
   "2": ">0,5–2",
   "3": ">2–5",
   "4": ">5"
  },
  "source_data": "КСЭК; ННЦООИ; ветеринарные и медицинские ИС; ГИС ББ",
  "rationale": "Использовать для корректировки НПА и цифровой оценки риска",
  "gid": "V-5",
  "priority": "A0",
  "factor_class": "dynamic",
  "measures": "Реализация комплексных противочумных мероприятий в очаге согласно нормативным правовым актам.",
  "normative_doc": "Закон РК № 122-VII от 21.05.2022; Приказ МЗ РК № ҚР ДСМ-114; ветеринарные правила.",
  "responsible": "ННЦООИ им. М. Айкимбаева; КСЭК; МИО.",
  "tier": "basic"
 },
 {
  "no": 6,
  "category": "Эпизоотическая активность",
  "name": "Доля положительных проб блох/эктопаразитов на Y. pestis, %",
  "type": "numeric",
  "weight": 4,
  "red_trigger": false,
  "direction": "выше=хуже",
  "scale": {
   "0": "0",
   "1": ">0–0,2",
   "2": ">0,2–1",
   "3": ">1–3",
   "4": ">3"
  },
  "source_data": "КСЭК; ННЦООИ; ветеринарные и медицинские ИС; ГИС ББ",
  "rationale": "Использовать для корректировки НПА и цифровой оценки риска",
  "gid": "V-6",
  "priority": "A0",
  "factor_class": "dynamic",
  "measures": "Эпизоотологическое и энтомологическое обследование очаговых территорий; ДДД-обработка (дератизация, дезинсекция, дезинфекция); сезонный мониторинг численности резервуаров и переносчиков; экстренная актуализация GIS-паспорта очага.",
  "normative_doc": "Закон РК «О биологической безопасности» № 122-VII от 21.05.2022; Приказ МЗ РК № ҚР ДСМ-114 от 12.11.2021 (санитарные правила по особо опасным инфекциям); санитарные правила по чуме.",
  "responsible": "ННЦООИ им. М. Айкимбаева (противочумная служба); КСЭК; территориальные противочумные станции; МИО.",
  "tier": "basic"
 },
 {
  "no": 7,
  "category": "Эпизоотическая активность",
  "name": "Число лабораторных находок Y. pestis за сезон на 10 000 км²",
  "type": "numeric",
  "weight": 4,
  "red_trigger": false,
  "direction": "выше=хуже",
  "scale": {
   "0": "0",
   "1": "1",
   "2": "2–3",
   "3": "4–9",
   "4": "≥10"
  },
  "source_data": "КСЭК; ННЦООИ; ветеринарные и медицинские ИС; ГИС ББ",
  "rationale": "Использовать для корректировки НПА и цифровой оценки риска",
  "gid": "V-7",
  "priority": "A0",
  "factor_class": "dynamic",
  "measures": "Организация работы с Y. pestis на уровне BSL-3; валидированные процедуры упаковки и транспортировки; обучение и СОП; геномная характеристика изолятов; контроль доступа и журналы; реагирование на лабораторные инциденты.",
  "normative_doc": "Закон РК № 122-VII от 21.05.2022; Приказ МЗ РК № ҚР ДСМ-125 от 02.11.2022 (правила биологической защиты); Приказ МЗ РК № ҚР ДСМ-126 от 03.11.2022 (разрешения на ПБА).",
  "responsible": "ННЦООИ им. М. Айкимбаева; КСЭК; уполномоченные диагностические лаборатории; внутренние ведомственные базы данных секвенирования.",
  "tier": "basic"
 },
 {
  "no": 8,
  "category": "Эпизоотическая активность",
  "name": "Доля выполненных маршрутов эпизоотологического обследования, %",
  "type": "numeric",
  "weight": 3,
  "red_trigger": false,
  "direction": "ниже=хуже",
  "scale": {
   "0": "≥95",
   "1": "85–94",
   "2": "70–84",
   "3": "50–69",
   "4": "<50"
  },
  "source_data": "КСЭК; ННЦООИ; ветеринарные и медицинские ИС; ГИС ББ",
  "rationale": "Использовать для корректировки НПА и цифровой оценки риска",
  "gid": "V-8",
  "priority": "A0",
  "factor_class": "dynamic",
  "measures": "Реализация комплексных противочумных мероприятий в очаге согласно нормативным правовым актам.",
  "normative_doc": "Закон РК № 122-VII от 21.05.2022; Приказ МЗ РК № ҚР ДСМ-114; ветеринарные правила.",
  "responsible": "ННЦООИ им. М. Айкимбаева; КСЭК; МИО.",
  "tier": "basic"
 },
 {
  "no": 9,
  "category": "Контакт человека с очагом",
  "name": "Доля активных участков в радиусе 10 км от поселений/пастбищ/объектов, %",
  "type": "numeric",
  "weight": 4,
  "red_trigger": false,
  "direction": "выше=хуже",
  "scale": {
   "0": "0",
   "1": ">0–5",
   "2": ">5–15",
   "3": ">15–30",
   "4": ">30"
  },
  "source_data": "КСЭК; ННЦООИ; ветеринарные и медицинские ИС; ГИС ББ",
  "rationale": "Использовать для корректировки НПА и цифровой оценки риска",
  "gid": "V-9",
  "priority": "A0",
  "factor_class": "dynamic",
  "measures": "Информирование населения и групп риска перед сезоном; учёт сезонных стоянок и пастбищ в зонах активных участков очага; ограничительные меры на работы в активном очаге; обязательный учёт GIS-паспорта при размещении вахтовых объектов.",
  "normative_doc": "Приказ МЗ РК № ҚР ДСМ-114 от 12.11.2021; ветеринарные правила (Приказ МСХ РК № 7-1/587).",
  "responsible": "МИО; КСЭК; КВКН МСХ; ветеринарные службы.",
  "tier": "basic"
 },
 {
  "no": 10,
  "category": "Контакт человека с очагом",
  "name": "Минимальная дистанция до активного участка очага, км",
  "type": "numeric",
  "weight": 3,
  "red_trigger": false,
  "direction": "ниже=хуже",
  "scale": {
   "0": ">50",
   "1": "20–50",
   "2": "10–19",
   "3": "5–9",
   "4": "<5"
  },
  "source_data": "КСЭК; ННЦООИ; ветеринарные и медицинские ИС; ГИС ББ",
  "rationale": "Использовать для корректировки НПА и цифровой оценки риска",
  "gid": "V-10",
  "priority": "A0",
  "factor_class": "structural",
  "measures": "Реализация комплексных противочумных мероприятий в очаге согласно нормативным правовым актам.",
  "normative_doc": "Закон РК № 122-VII от 21.05.2022; Приказ МЗ РК № ҚР ДСМ-114; ветеринарные правила.",
  "responsible": "ННЦООИ им. М. Айкимбаева; КСЭК; МИО.",
  "tier": "basic"
 },
 {
  "no": 11,